<?xml version="1.0" encoding="UTF-8"?>

<!ELEMENT students (student+)>
<!ELEMENT student (name,rollno)>
<!ELEMENT name (#PCDATA)>
<!ELEMENT rollno (#PCDATA)> 